{
  "meta": {
    "secteur": "Parfumerie, Aromes & Cosmetique",
    "segment": "Compositions & ingredients B2B",
    "geographie": "France entiere (metropole + DROM), bassin de Grasse prioritaire",
    "date_snapshot": "2026-08-14",
    "compte_etalon": "Robertet",
    "auteur": "Claude Opus — etape E5, corpus MASTER-STUDY KREDO",
    "version": "1.0",
    "variante": "master",
    "compte_pivot": null,
    "run_precedent": null
  },
  "comptes": [
    {
      "nom": "Robertet",
      "identifiant_national": null,
      "code_activite": null,
      "convention_collective": null,
      "effectif_france": null,
      "groupe": "Groupe Robertet (contrôle familial Maubert)",
      "branche_retenue": "Divisions Parfumerie, Matieres Premieres et Aromes, perimetre France (site industriel du Plan de Grasse)",
      "categorie": "leader",
      "justification_categorie": "Part relative NON CALCULABLE : Robertet ne publie pas de compte de resultat isole pour sa seule branche France du segment, seulement un consolide groupe. Critere de substitution (a) puis (b) : premier role auto-designe du bassin (regroupement industriel Robertet Plan + Charabot passant en Seveso seuil haut, consultation publique prefectorale 24/02-25/03/2025) et capacite demontree a porter les projets les plus complexes (17 centres de creation, programme IA proprietaire NaturIA, integration amont-aval du sourcing a la composition).",
      "critere_substitution": "Part relative non calculable (pas de CA de branche France publie). Substitution (a) presence sur les operations industrielles majeures du bassin, puis (b) capacite a porter les projets les plus complexes.",
      "ca_meur": 843.9,
      "exercice": 2025,
      "perimetre_ca": "groupe monde (consolide) — le CA de branche France n'est pas publie",
      "rayon": "international",
      "empreinte_metier": 5,
      "maturite_numerique": 5,
      "reputation": "forte",
      "appetence": {
        "capacite_a_payer": 5,
        "intensite_it": 5,
        "moment": 5,
        "accessibilite": 5,
        "fit_offre": 5,
        "total": 35,
        "preuves": {
          "capacite_a_payer": "CA groupe 2025 de 843,9 MEUR et EBITDA de 174 MEUR (marge 20,6 %), source emetteur.",
          "intensite_it": "Directeur des Systemes d'Information au Global identifie publiquement comme intervenant, et programme d'IA generative proprietaire NaturIA cite par la direction executive parmi les projets structurants de gestion de donnees.",
          "moment": "CA du 1er semestre 2026 en leger repli (-0,5 %, 444 MEUR) publie en juillet 2026 ; table ronde publique sur l'IA a Grasse le 22/06/2026 avec le DSI Global et le directeur de l'innovation parfumerie.",
          "accessibilite": "Compte deja client de KREDO (00-cadrage.json, comptes_exclus) et fonction SI identifiee publiquement : la porte est ouverte et l'interlocuteur est nomme.",
          "fit_offre": "Les chantiers cites (gouvernance de donnees, creation assistee par IA) correspondent directement a data-ai-strategy-governance, ai-machine-learning-mlops et data-platforms-engineering-dataops."
        }
      },
      "accessibilite": 5,
      "trigger_events": [
        {
          "date": "2026-07",
          "fait": "Publication d'un chiffre d'affaires semestriel 2026 de 444 MEUR, en leger repli de 0,5 %, avec des dynamiques contrastees par division.",
          "source": "https://www.premiumbeautynews.com/fr/robertet-la-parfumerie-soutient-un,27968"
        },
        {
          "date": "2026-06",
          "fait": "Le Directeur des SI au Global et le Directeur de l'Innovation parfumerie interviennent publiquement sur le programme d'IA generative NaturIA lors des IA Dates a Grasse, le 22/06/2026.",
          "source": "https://www.maison-intelligence-artificielle.com/agenda/ia-dates-aromes-et-parfums/"
        },
        {
          "date": "2026-02",
          "fait": "Publication du CA 2025 a 843,9 MEUR, croissance organique de 7,6 %, et relevement de l'objectif de CA a horizon 2030 annonce lors du premier Capital Markets Day tenu a Grasse.",
          "source": "https://www.robertet.com/wp-content/uploads/2026/02/RESULTATS-2025.pdf"
        }
      ],
      "profil_compte": {
        "metier_chaine_valeur": "Seul acteur du segment integre du sourcing agricole a la composition finale : achat et transformation de matieres naturelles, production d'ingredients, formulation parfumerie et aromes, documentation reglementaire et service client B2B. Fournisseurs amont : filieres agricoles contractualisees et producteurs d'extraits. Valeur propre : maitrise du naturel, de l'extraction a la formule. Clients : marques de parfumerie fine, cosmetique, agroalimentaire et Health & Beauty. Autres metiers du groupe cites sans etre analyses : nutraceutique et actifs sante-beaute.",
        "maillon": "Presence sur les six maillons de 04-secteur.json, avec un centre de gravite sur les maillons 1 (sourcing et qualification des matieres), 3 (creation et formulation) et 4 (reglementaire, qualite et documentation client).",
        "contrats_majeurs": [
          {
            "objet": "Regroupement des etablissements Robertet Plan et Charabot sur la commune de Grasse, entrainant le passage au statut Seveso seuil haut ; procedure de participation du public par voie electronique organisee par arrete prefectoral n 17609.",
            "date": "2025-02",
            "montant": "non publie",
            "source": "https://www.societe.com/societe/robertet-sa-415750660.html"
          },
          {
            "objet": "Mise en fonction d'une nouvelle usine en Indonesie et ouverture de filiales en Australie et en Pologne au titre de l'exercice 2025.",
            "date": "2025-12",
            "montant": "non publie",
            "source": "https://www.robertet.com/groupe/gouvernance/equipe-de-direction-executive/"
          }
        ],
        "grilles": {
          "financiere": "CA groupe 2025 de 843,9 MEUR, en hausse de 4,5 % en donnees publiees et de 7,6 % en organique ; EBITDA de 174 MEUR, marge de 20,6 %. Exercice precedent : 807,6 MEUR (2024). Premier semestre 2026 a 444 MEUR, en repli de 0,5 %. PERIMETRE : consolide monde. Le CA de la branche France n'est pas publie et n'est pas reconstitue ici.",
          "empreinte": "Couverture complete de la chaine, de la plante au concentre livre, avec une integration amont revendiquee comme differenciante. Note 5/5.",
          "reputation": "Faits observables : classement Platinum EcoVadis mentionne par la direction executive, 175 ans celebres en 2025, cotation Euronext et publication reguliere de resultats. Perception qualifiee forte — c'est une perception, pas une mesure.",
          "innovation": "R&D structuree autour du naturel : 17 centres de creation, accelerateur de start-up a Grasse, depots de brevets sur les technologies anti-odeur Neutral et Neutral Plus, gamme ActiScent adossee a des tests d'efficacite.",
          "ia_annonce_vs_deploye": "ANNONCE : la direction executive declare accelerer la digitalisation avec des projets structurants de gestion de donnees et de creation assistee par intelligence artificielle, et le rapport financier 2025 evoque l'intelligence artificielle. DEPLOYE : NaturIA, outil d'IA generative construit sur mesure pour interagir avec la palette d'ingredients et accelerer la creation olfactive, est documente sur le site de l'entreprise et presente publiquement le 22/06/2026 par le Directeur de l'Innovation parfumerie qui en a la charge, aux cotes du Directeur des SI au Global. ECART : faible sur la creation — c'est le seul compte du segment ou l'annonce est adossee a un produit nomme, a un responsable identifie et a une prise de parole publique. L'ecart se deplace en aval : rien de public ne documente la gouvernance des donnees, les droits d'acces aux formules ni l'industrialisation MLOps qui conditionnent le passage de l'outil de creation a un usage generalise. C'est la que se trouve le besoin, pas dans la demonstration d'IA.",
          "avantages": "Integration verticale du naturel unique sur le segment, actionnariat familial stable, notoriete de place, capacite d'investissement autofinancee.",
          "vulnerabilite_principale": "Exposition au change et aux effets de perimetre, visible au premier semestre 2026 ou la croissance publiee devient negative alors que l'organique reste positive.",
          "trajectoire": "Sur dix ans, passage d'un acteur des matieres premieres a un groupe integre de 843,9 MEUR ; objectif de CA a horizon 2030 releve en mai 2026 ; extension industrielle en Inde et en Indonesie ; renforcement simultane des sites de Grasse."
        },
        "couche_esn": {
          "organisation_si": "Une direction des systemes d'information de niveau groupe existe et est identifiee publiquement : le Directeur des Systemes d'Information au Global intervient a titre professionnel lors des IA Dates du 22/06/2026 a Grasse. La fonction innovation parfumerie porte separement les programmes d'IA. Date de prise de fonction non publiee.",
          "decideur_si": "Directeur des Systemes d'Information au Global (fonction publique, attestee par le programme des IA Dates du 22/06/2026). Directeur de l'Innovation pour la division parfumerie, en charge des programmes IA dont NaturIA.",
          "modele_achat": "Aucun espace fournisseur ni conditions generales d'achat IT publies n'ont ete trouves sur le site institutionnel au 14/08/2026. HYPOTHESE QUALIFIEE, A CONFIRMER : societe cotee de plus de 2 500 personnes avec une DSI groupe, donc achat IT centralise au siege de Grasse, avec referencement et mise en concurrence formalisee ; le classement EcoVadis Platinum cite par la direction implique un dispositif d'evaluation fournisseurs documente. Recherche effectuee : site institutionnel, pages gouvernance et RSE, requete ciblee sur charte achats responsables et code de conduite fournisseur.",
          "modele_achat_statut": "hypothese_qualifiee",